{
  "schema_version": "1.0.0",
  "catalog_version": "2.0.0",
  "runtime_source": {
    "path": "data/syllabus.json",
    "status": "legacy-operational",
    "catalog_is_runtime_source": false
  },
  "syllabi": [
    {
      "id": "SYL-GSI-2025",
      "opposition_id": "OPP-GSI",
      "name": "Gestión de Sistemas e Informática de la Administración del Estado — GSI A2, ingreso libre",
      "status": "legacy-operational",
      "runtime_available": true,
      "identifier_policy": {
        "operational_id_kind": "legacy",
        "canonical_ids_status": "informational"
      },
      "program_version": {
        "convocation": "BOE-A-2025-26262",
        "official_program_date": "2025-12-22",
        "legacy_data_version": "2.0.0"
      },
      "provenance": {
        "official": true,
        "source_id": "SRC-BOE-GSI-2025",
        "document_id": "DOC-BOE-GSI-2025",
        "document_path": "documents/markdown/gsi/BOE-A-2025-26262-Anexo-IX.md",
        "locator": "Anexo IX"
      },
      "declared_structure": {
        "block_count": 4,
        "topic_count": 57,
        "distribution": [
          10,
          16,
          15,
          16
        ],
        "topics_extracted": true
      },
      "legacy_source_path": "data/syllabus.json",
      "blocks": [
        {
          "legacy_id": "B1",
          "canonical_id": "GSI-B1",
          "local_official_code": "I",
          "order": 1,
          "title": "Organización del Estado y Administración electrónica",
          "legacy_status": "active",
          "historical_aliases": [],
          "topics": [
            {
              "legacy_id": "B1-T01",
              "canonical_id": "GSI-B1-T01",
              "local_official_code": "I.1",
              "order": 1,
              "title": "La Constitución Española de 1978. Derechos y deberes fundamentales. Su garantía y suspensión. La Corona: funciones constitucionales del Rey.",
              "legacy_status": "active",
              "legacy_content_path": "content/topics/B1-T01.md",
              "legacy_generated_path": "content/generated/B1-T01.html",
              "historical_aliases": []
            },
            {
              "legacy_id": "B1-T02",
              "canonical_id": "GSI-B1-T02",
              "local_official_code": "I.2",
              "order": 2,
              "title": "Las Cortes Generales: atribuciones del Congreso de los Diputados y del Senado. El Tribunal Constitucional: composición y atribuciones. El Defensor del Pueblo.",
              "legacy_status": "active",
              "legacy_content_path": "content/topics/B1-T02.md",
              "legacy_generated_path": "content/generated/B1-T02.html",
              "historical_aliases": []
            },
            {
              "legacy_id": "B1-T03",
              "canonical_id": "GSI-B1-T03",
              "local_official_code": "I.3",
              "order": 3,
              "title": "El Gobierno: composición, nombramiento y cese. Las funciones del Gobierno. Relaciones entre el Gobierno y las Cortes Generales.",
              "legacy_status": "active",
              "legacy_content_path": "content/topics/B1-T03.md",
              "legacy_generated_path": "content/generated/B1-T03.html",
              "historical_aliases": []
            },
            {
              "legacy_id": "B1-T04",
              "canonical_id": "GSI-B1-T04",
              "local_official_code": "I.4",
              "order": 4,
              "title": "La Ley 19/2013, de 9 de diciembre, de transparencia, acceso a la información pública y buen gobierno. La Agenda 2030 y los Objetivos de Desarrollo Sostenible.",
              "legacy_status": "active",
              "legacy_content_path": "content/topics/B1-T04.md",
              "legacy_generated_path": "content/generated/B1-T04.html",
              "historical_aliases": []
            },
            {
              "legacy_id": "B1-T05",
              "canonical_id": "GSI-B1-T05",
              "local_official_code": "I.5",
              "order": 5,
              "title": "Políticas de igualdad y contra la violencia de género. Políticas de igualdad de trato y no discriminación de las personas LGTBI. Discapacidad y dependencia: régimen jurídico.",
              "legacy_status": "active",
              "legacy_content_path": "content/topics/B1-T05.md",
              "legacy_generated_path": "content/generated/B1-T05.html",
              "historical_aliases": []
            },
            {
              "legacy_id": "B1-T06",
              "canonical_id": "GSI-B1-T06",
              "local_official_code": "I.6",
              "order": 6,
              "title": "La sociedad de la información. La Agenda Digital para España. Identidad y firma electrónica: régimen jurídico. Reglamento eIDAS. El DNI electrónico.",
              "legacy_status": "active",
              "legacy_content_path": "content/topics/B1-T06.md",
              "legacy_generated_path": "content/generated/B1-T06.html",
              "historical_aliases": []
            },
            {
              "legacy_id": "B1-T07",
              "canonical_id": "GSI-B1-T07",
              "local_official_code": "I.7",
              "order": 7,
              "title": "La protección de datos personales y su régimen jurídico: principios, derechos, responsable y encargado del tratamiento, delegado y autoridades de protección de datos. Derechos digitales.",
              "legacy_status": "active",
              "legacy_content_path": "content/topics/B1-T07.md",
              "legacy_generated_path": "content/generated/B1-T07.html",
              "historical_aliases": []
            },
            {
              "legacy_id": "B1-T08",
              "canonical_id": "GSI-B1-T08",
              "local_official_code": "I.8",
              "order": 8,
              "title": "Las Leyes de Procedimiento Administrativo Común de las Administraciones Públicas y de Régimen Jurídico del Sector Público. El texto refundido del Estatuto Básico del Empleo Público.",
              "legacy_status": "active",
              "legacy_content_path": "content/topics/B1-T08.md",
              "legacy_generated_path": "content/generated/B1-T08.html",
              "historical_aliases": []
            },
            {
              "legacy_id": "B1-T09",
              "canonical_id": "GSI-B1-T09",
              "local_official_code": "I.9",
              "order": 9,
              "title": "Instrumentos para el acceso electrónico a las Administraciones públicas: sedes electrónicas, canales y punto de acceso, identificación y autenticación. Datos abiertos. Normativa vigente de reutilización de la información del sector público. La gestión electrónica de los procedimientos administrativos. Esquema Nacional de Seguridad (ENS). Esquema Nacional de Interoperabilidad (ENI). Normas técnicas de interoperabilidad. Guías CCN-STIC serie 800.",
              "legacy_status": "active",
              "legacy_content_path": "content/topics/B1-T09.md",
              "legacy_generated_path": "content/generated/B1-T09.html",
              "historical_aliases": []
            },
            {
              "legacy_id": "B1-T10",
              "canonical_id": "GSI-B1-T10",
              "local_official_code": "I.10",
              "order": 10,
              "title": "Instrumentos y órganos para la cooperación entre Administraciones públicas en materia de Administración electrónica. Infraestructuras y servicios comunes. Plataformas de validación e interconexión de redes.",
              "legacy_status": "active",
              "legacy_content_path": "content/topics/B1-T10.md",
              "legacy_generated_path": "content/generated/B1-T10.html",
              "historical_aliases": []
            }
          ]
        },
        {
          "legacy_id": "B2",
          "canonical_id": "GSI-B2",
          "local_official_code": "II",
          "order": 2,
          "title": "Tecnología básica",
          "legacy_status": "active",
          "historical_aliases": [],
          "topics": [
            {
              "legacy_id": "B2-T01",
              "canonical_id": "GSI-B2-T01",
              "local_official_code": "II.1",
              "order": 1,
              "title": "Tecnologías actuales de ordenadores: de los dispositivos móviles a los superordenadores y arquitecturas escalables y de altas prestaciones. Computación en la nube. Base tecnológica. Componentes, funcionalidades y capacidades.",
              "legacy_status": "active",
              "legacy_content_path": "content/topics/B2-T01.md",
              "legacy_generated_path": "content/generated/B2-T01.html",
              "historical_aliases": []
            },
            {
              "legacy_id": "B2-T02",
              "canonical_id": "GSI-B2-T02",
              "local_official_code": "II.2",
              "order": 2,
              "title": "Conceptos y fundamentos de los sistemas operativos. Características técnicas, funcionales y de administración: Windows, Linux, Unix y otros. Sistemas operativos para dispositivos móviles.",
              "legacy_status": "active",
              "legacy_content_path": "content/topics/B2-T02.md",
              "legacy_generated_path": "content/generated/B2-T02.html",
              "historical_aliases": []
            },
            {
              "legacy_id": "B2-T03",
              "canonical_id": "GSI-B2-T03",
              "local_official_code": "II.3",
              "order": 3,
              "title": "Características técnicas de los lenguajes y paradigmas actuales de programación.",
              "legacy_status": "active",
              "legacy_content_path": "content/topics/B2-T03.md",
              "legacy_generated_path": "content/generated/B2-T03.html",
              "historical_aliases": []
            },
            {
              "legacy_id": "B2-T04",
              "canonical_id": "GSI-B2-T04",
              "local_official_code": "II.4",
              "order": 4,